Constraint Name;Time Step Type;Doc String
``constraint_linear_conversion_factor;``set_time_steps_operation``;Linear relationship in conversion_factor
``constraint_capex_coupling;``set_time_steps_yearly``;couples the real capex variables with the approximated variables
``constraint_capacity_coupling;``set_time_steps_yearly``;couples the real capacity variables with the approximated variables
``constraint_reference_flow_coupling;``set_time_steps_operation``;couples the real reference flow variables with the approximated variables
``constraint_dependent_flow_coupling;``set_time_steps_operation``;couples the real dependent flow variables with the approximated variables
