Variable Name;Time Step Type;Doc String;Unit Category
``carbon_emissions_annual``;``set_time_steps_yearly``;annual carbon emissions of {"emissions": 1}
``carbon_emissions_cumulative``;``set_time_steps_yearly``;cumulative carbon emissions of energy system over time for each year;{"emissions": 1}
``carbon_emissions_budget_overshoot``;``set_time_steps_yearly``;overshoot carbon emissions of energy system at the end of the time horizon;{"emissions": 1}
``carbon_emissions_annual_overshoot``;``set_time_steps_yearly``;overshoot of the annual carbon emissions limit of {"emissions": 1}
``cost_carbon_emissions_total``;``set_time_steps_yearly``;total cost of carbon emissions of {"money": 1}
``cost_total``;``set_time_steps_yearly``;total cost of {"money": 1}
``net_present_cost``;``set_time_steps_yearly``;net_present_cost of {"money": 1}